{
  "schema_version": 1,
  "contract_id": "radroots_event_store.raw_source_rebuild_v1",
  "authority_id": "raw_source_rebuild_v1",
  "manifest_schema": {
    "path": "crates/event_store/contracts/raw_source_rebuild_v1.manifest.schema.json",
    "byte_length": 17896,
    "sha256": "f9d210967e54b66f39c8bb965d97b2001a0ebc0927e7c2c14edb8e474bfda695",
    "hash_algorithm": "sha256_bytes_v1"
  },
  "predecessor": {
    "contract_id": "radroots_event_store.source_maintenance_v1",
    "manifest": {
      "path": "crates/event_store/contracts/source_maintenance_v1.manifest.json",
      "byte_length": 14216,
      "sha256": "e8911e6e5710278969cbd15557a5b856b1575dfd11a655711403598370b41221",
      "hash_algorithm": "sha256_bytes_v1"
    }
  },
  "migration_inventory": [
    {
      "path": "crates/event_store/migrations/0001_event_store.down.sql",
      "byte_length": 522,
      "sha256": "fa84d587f657f601947eaeb9cd239c962a48f6fcdce723588476e8d22f3c1f53",
      "hash_algorithm": "sha256_bytes_v1"
    },
    {
      "path": "crates/event_store/migrations/0001_event_store.up.sql",
      "byte_length": 10712,
      "sha256": "4c03906a1cffd418a48d40907aa9a1ca51bb41766cff7250c4dfc7c2fd6eddde",
      "hash_algorithm": "sha256_bytes_v1"
    },
    {
      "path": "crates/event_store/migrations/0002_nip09.down.sql",
      "byte_length": 4807,
      "sha256": "c51a099d9501f1e692c13d2226296a68ed9e6bfa5e8e46b2f12c6574dbe59e31",
      "hash_algorithm": "sha256_bytes_v1"
    },
    {
      "path": "crates/event_store/migrations/0002_nip09.up.sql",
      "byte_length": 81614,
      "sha256": "0c1730ff36eaebd285f9c0c94b9b7346af60266afa55c24a18e30446d369581a",
      "hash_algorithm": "sha256_bytes_v1"
    },
    {
      "path": "crates/event_store/migrations/0003_food_availability_projection.down.sql",
      "byte_length": 1755,
      "sha256": "29d663320109d9dd0df6a00b6a53d8d988438d01f7a66960a9d4ba3482ffffb8",
      "hash_algorithm": "sha256_bytes_v1"
    },
    {
      "path": "crates/event_store/migrations/0003_food_availability_projection.up.sql",
      "byte_length": 23683,
      "sha256": "4e7edfb981b25f76055efc7802ec30b4034eeae9b9c0809ea4ea7c574678748a",
      "hash_algorithm": "sha256_bytes_v1"
    },
    {
      "path": "crates/event_store/migrations/0004_source_maintenance.down.sql",
      "byte_length": 5172,
      "sha256": "fe44fd53c51545c08ea479b385e6781079dab70fc63da2a3c205d727a00ce860",
      "hash_algorithm": "sha256_bytes_v1"
    },
    {
      "path": "crates/event_store/migrations/0004_source_maintenance.up.sql",
      "byte_length": 19841,
      "sha256": "425dc799f392b87f265a6fb81f89c4a1c7a5db8391ab0380970708cb9c66704d",
      "hash_algorithm": "sha256_bytes_v1"
    }
  ],
  "runtime": {
    "event_store_schema_version": 4,
    "event_contract_registry_version": 7,
    "transaction_mode": "begin_immediate_v1",
    "projection_cursor_count_limit": 4096,
    "projection_cursor_rejection_probe_limit": 4097,
    "caller_main_table_count_limit": 4096,
    "caller_foreign_key_row_count_limit": 4096,
    "caller_inbound_foreign_key_policy": "reject_all_rebuild_mutated_parent_dependencies_before_entropy_v1",
    "caller_inbound_foreign_key_parent_tables": [
      "event_envelopes",
      "event_envelope_tags",
      "event_envelope_head",
      "radroots_event_store_source_generation",
      "radroots_event_store_source_rebuild_commit_barrier",
      "radroots_event_store_source_rebuild_marker",
      "radroots_event_store_source_state",
      "radroots_event_store_write_lock",
      "radroots_event_store_source_capacity_v1",
      "radroots_event_store_event_coordinate",
      "radroots_event_store_nip09_request",
      "radroots_event_store_nip09_event_target",
      "radroots_event_store_nip09_address_target",
      "radroots_event_store_addressable_head_state",
      "radroots_event_store_addressable_head_transition",
      "radroots_event_store_addressable_feed_integrity_v1",
      "radroots_event_store_food_availability_cursor",
      "radroots_event_store_food_availability_projection",
      "radroots_event_store_food_availability_image",
      "radroots_event_store_food_availability_search_fts",
      "radroots_event_store_food_availability_search_fts_config",
      "radroots_event_store_food_availability_search_fts_content",
      "radroots_event_store_food_availability_search_fts_data",
      "radroots_event_store_food_availability_search_fts_docsize",
      "radroots_event_store_food_availability_search_fts_idx",
      "sqlite_sequence"
    ],
    "cold_repair_mode": "canonical_file_only_single_connection_lock_domain_probe_v1",
    "immutable_raw_digest": {
      "algorithm": "sha256_domain_nul_typed_fields_v1",
      "domain_utf8": "radroots:event-store:immutable-raw-digest:v1",
      "domain_terminator": "nul_byte",
      "framing": {
        "section": "S_then_N_then_u64be_length_then_utf8_name",
        "row": "R",
        "signed_i64": "I_then_i64be",
        "boolean": "B_then_u8_0_or_1",
        "optional": "O_then_presence_u8_then_nested_value_when_present",
        "text": "T_then_u64be_length_then_utf8_bytes",
        "blob": "X_then_u64be_length_then_bytes"
      },
      "output_bytes": 32,
      "source_queries": [
        {
          "section": "event_envelopes",
          "sql": "SELECT seq, event_id, pubkey, created_at, kind, tags_json, content, sig, raw_json, inserted_at_ms FROM event_envelopes ORDER BY seq",
          "fields": [
            {
              "name": "seq",
              "framing": "i64"
            },
            {
              "name": "event_id",
              "framing": "text"
            },
            {
              "name": "pubkey",
              "framing": "text"
            },
            {
              "name": "created_at",
              "framing": "i64"
            },
            {
              "name": "kind",
              "framing": "i64"
            },
            {
              "name": "tags_json",
              "framing": "text"
            },
            {
              "name": "content",
              "framing": "text"
            },
            {
              "name": "sig",
              "framing": "text"
            },
            {
              "name": "raw_json",
              "framing": "text"
            },
            {
              "name": "inserted_at_ms",
              "framing": "i64"
            }
          ]
        },
        {
          "section": "event_envelope_tags",
          "sql": "SELECT event.seq, tag.event_id, tag.tag_index, tag.tag_name, tag.tag_value, tag.tag_json FROM event_envelope_tags AS tag JOIN event_envelopes AS event ON event.event_id = tag.event_id ORDER BY event.seq, tag.tag_index",
          "fields": [
            {
              "name": "seq",
              "framing": "i64"
            },
            {
              "name": "event_id",
              "framing": "text"
            },
            {
              "name": "tag_index",
              "framing": "i64"
            },
            {
              "name": "tag_name",
              "framing": "text"
            },
            {
              "name": "tag_value",
              "framing": "optional_text"
            },
            {
              "name": "tag_json",
              "framing": "text"
            }
          ]
        }
      ]
    },
    "active_product_state_digest": {
      "algorithm": "sha256_domain_nul_typed_fields_v1",
      "domain_utf8": "radroots:event-store:active-product-state-digest:v1",
      "domain_terminator": "nul_byte",
      "framing": {
        "section": "S_then_N_then_u64be_length_then_utf8_name",
        "row": "R",
        "signed_i64": "I_then_i64be",
        "boolean": "B_then_u8_0_or_1",
        "optional": "O_then_presence_u8_then_nested_value_when_present",
        "text": "T_then_u64be_length_then_utf8_bytes",
        "blob": "X_then_u64be_length_then_bytes"
      },
      "output_bytes": 32,
      "components": [
        "logical_current_classifications",
        "raw_heads",
        "active_addressable_head_state",
        "active_nip09_facts",
        "current_visibility",
        "food_availability_rows",
        "food_availability_images",
        "logical_food_fts_rows",
        "stable_food_cursor_metadata"
      ],
      "exclusions": [
        "source_generation",
        "absolute_transition_sequence",
        "transition_history",
        "rebuild_origin",
        "rebuild_cause",
        "operational_timestamps",
        "generic_projection_cursors",
        "caller_owned_state"
      ],
      "component_queries": [
        {
          "section": "envelope_classification",
          "sql": "SELECT event_id, verification_status, contract_status, contract_id, event_class, projection_eligible FROM event_envelopes ORDER BY event_id",
          "fields": [
            {
              "name": "event_id",
              "framing": "text"
            },
            {
              "name": "verification_status",
              "framing": "text"
            },
            {
              "name": "contract_status",
              "framing": "text"
            },
            {
              "name": "contract_id",
              "framing": "optional_text"
            },
            {
              "name": "event_class",
              "framing": "optional_text"
            },
            {
              "name": "projection_eligible",
              "framing": "boolean"
            }
          ]
        },
        {
          "section": "tag_classification",
          "sql": "SELECT event_id, tag_index, contract_semantic, contract_value_type, relay_indexed FROM event_envelope_tags ORDER BY event_id, tag_index",
          "fields": [
            {
              "name": "event_id",
              "framing": "text"
            },
            {
              "name": "tag_index",
              "framing": "i64"
            },
            {
              "name": "contract_semantic",
              "framing": "optional_text"